<!ELEMENT Privileges (Privilege+)>
    <!ELEMENT Privilege (membership)>
        <!ATTLIST Privilege id ID #REQUIRED>
    <!ELEMENT membership (mgroup*)>
        <!ELEMENT mgroup EMPTY>
        <!ATTLIST mgroup idref IDREF #REQUIRED>